{
  "smtpErrorCode" : "undefined" ,
  "smtpStatusCode" : "undefined" ,
  "smtpMessage" : "undefined" ,
  "emailId" : "4821" ,
  "emailName" : "undefined" ,
  "emailFromAddress" : "undefined" ,
  "emailToAddress" : "undefined" ,
  "category" : "undefined" ,
  "id" : "undefined" ,
  "performedAt" : "undefined"
}